{
  "$schema": "../schemas/harness-authority-contracts.schema.json",
  "schemaVersion": 2,
  "kind": "provider-neutral-governance-harness-authority-contracts",
  "closurePolicy": "every-registry-claim-is-bound-to-exact-manifest-sources-and-executed-test-owners",
  "sharedAuthorityClosures": [
    {
      "id": "closed-tool-execution",
      "kind": "canonical-byte-exact-shared-runtime",
      "canonicalSourceId": "exact-closed-tool-execution-library",
      "adapter": {
        "sourceId": "exact-closed-tool-execution-authority-adapter",
        "contract": "single-static-re-export",
        "moduleSpecifier": "../../packages/governance/src/closed-tool-execution.mjs"
      },
      "directProjections": [
        {
          "id": "fork-common-runtime",
          "path": "packages/design-system/ds-canonical/fork/common/closed-tool-execution.mjs",
          "builderSourceId": "exact-fork-governance-builder",
          "comparison": "canonical-byte-exact"
        },
        {
          "id": "fork-consumer-runtime",
          "path": "packages/design-system/ds-canonical/fork/consumer/lib/closed-tool-execution.mjs",
          "builderSourceId": "exact-fork-governance-builder",
          "comparison": "canonical-byte-exact"
        }
      ],
      "managedFileProjection": {
        "id": "fork-consumer-managed-runtime",
        "destination": "scripts/lib/closed-tool-execution.mjs",
        "artifactRoot": "packages/design-system/ds-canonical/fork/consumer/managed-files",
        "builderSourceId": "exact-fork-governance-builder",
        "comparison": "canonical-byte-exact"
      },
      "externalMirrorProjection": {
        "builderSourceId": "exact-published-template-mirror-builder",
        "policySourceId": "exact-published-template-mirror-policy",
        "destination": "scripts/lib/closed-tool-execution.mjs",
        "comparison": "canonical-byte-exact"
      },
      "packageDelivery": {
        "manifestSourceId": "governance-package-contract",
        "packageName": "@qijenchen/governance",
        "filesRoot": "src",
        "exportSubpath": "./closed-tool-execution",
        "exportTarget": "./src/closed-tool-execution.mjs",
        "archiveBuilderSourceId": "release-bom-builder",
        "archiveEntry": "package/src/closed-tool-execution.mjs",
        "packExecutionOwner": {
          "kind": "test-path",
          "path": "scripts/test-release-bom.mjs"
        }
      },
      "executedTestOwners": [
        {
          "kind": "test-path",
          "path": "infra/governance/test/harness-registry.test.mjs"
        },
        {
          "kind": "test-path",
          "path": "scripts/test-consumer-governance.mjs"
        },
        {
          "kind": "test-path",
          "path": "scripts/test-fork-governance.mjs"
        },
        {
          "kind": "test-path",
          "path": "scripts/test-product-template-scaffold-lock.mjs"
        },
        {
          "kind": "test-path",
          "path": "scripts/test-release-bom.mjs"
        }
      ],
      "claims": {
        "proves": [
          "One canonical closed-tool runtime is byte-exact across the fork corpus, product template, authenticated managed-file artifact and npm package, while the authority-side root remains a single static re-export.",
          "The published-template mirror mapping and npm archive required-entry check are bound to executed Harness owners rather than inferred from source presence."
        ],
        "doesNotProve": [
          "A local byte-exact projection proves neither that an external published-template repository has accepted the mirror nor that an npm registry release is active."
        ]
      }
    }
  ],
  "entries": [
    {
      "entryId": "fresh-install-and-setup",
      "domain": "install",
      "authoritySourceIds": [
        "governance-root-script-registry",
        "governance-infrastructure-runbook",
        "exact-governance-setup-cli",
        "exact-provider-cli-package-content-proposer",
        "exact-provider-cli-proposal-verifier-fixture",
        "exact-provider-cli-toolchain-setup",
        "exact-workspace-setup",
        "provider-cli-toolchain-authority",
        "provider-cli-toolchain-exact-lock",
        "exact-provider-cli-package-content-proposal-schema",
        "provider-cli-toolchain-schema",
        "exact-product-template-scaffold-lock",
        "product-template-package-contract"
      ],
      "executedTestOwners": [
        {
          "kind": "test-path",
          "path": "scripts/test-setup-governance.mjs"
        },
        {
          "kind": "test-path",
          "path": "scripts/test-propose-provider-cli-package-content.mjs"
        },
        {
          "kind": "test-path",
          "path": "scripts/test-setup-provider-cli-toolchain.mjs"
        },
        {
          "kind": "test-path",
          "path": "scripts/test-setup-workspace.mjs"
        },
        {
          "kind": "test-path",
          "path": "scripts/test-verified-exact-npm-runtime.mjs"
        },
        {
          "kind": "test-path",
          "path": "scripts/test-product-template-scaffold-lock.mjs"
        }
      ],
      "claims": [
        {
          "claimId": "fresh-install-and-setup.proves.01",
          "entryId": "fresh-install-and-setup",
          "domain": "install",
          "kind": "proves",
          "text": "The template, local checkout, hosted setup documentation and devcontainer use setup:all as one closed entrypoint for role governance plus repository-provisioned peer CLIs.",
          "sourceIds": [
            "governance-root-script-registry",
            "governance-infrastructure-runbook",
            "exact-governance-setup-cli",
            "exact-workspace-setup",
            "product-template-package-contract"
          ],
          "executionOwners": [
            {
              "kind": "test-path",
              "path": "scripts/test-setup-governance.mjs"
            },
            {
              "kind": "test-path",
              "path": "scripts/test-setup-workspace.mjs"
            }
          ]
        },
        {
          "claimId": "fresh-install-and-setup.proves.02",
          "entryId": "fresh-install-and-setup",
          "domain": "install",
          "kind": "proves",
          "text": "Installed governance runs from an exact lockfile-bound npm runtime instead of an ambient package copy.",
          "sourceIds": [
            "governance-root-script-registry",
            "exact-governance-setup-cli",
            "provider-cli-toolchain-exact-lock"
          ],
          "executionOwners": [
            {
              "kind": "test-path",
              "path": "scripts/test-verified-exact-npm-runtime.mjs"
            }
          ]
        },
        {
          "claimId": "fresh-install-and-setup.proves.03",
          "entryId": "fresh-install-and-setup",
          "domain": "install",
          "kind": "proves",
          "text": "Claude Code and Codex peer CLIs are materialized atomically from one complete SRI-bound transitive lock and reject unsupported Linux libc, poisoned shims and version drift.",
          "sourceIds": [
            "exact-provider-cli-toolchain-setup",
            "provider-cli-toolchain-authority",
            "provider-cli-toolchain-exact-lock",
            "provider-cli-toolchain-schema"
          ],
          "executionOwners": [
            {
              "kind": "test-path",
              "path": "scripts/test-setup-provider-cli-toolchain.mjs"
            }
          ]
        },
        {
          "claimId": "fresh-install-and-setup.proves.04",
          "entryId": "fresh-install-and-setup",
          "domain": "install",
          "kind": "proves",
          "text": "Provider CLI package-content updates are derived by a deterministic proposal-only flow that downloads the shared resolver's active closure sequentially, delegates authority/lock/plan validation plus SRI and strict tar parsing to the installation SSOT, binds direct derivation-source hashes and the exact input-to-proposed manifest transition, supports independent zero-write pre/post-state verification that refetches and rederives every exact artifact, and has no direct apply mode.",
          "sourceIds": [
            "exact-provider-cli-package-content-proposer",
            "exact-provider-cli-proposal-verifier-fixture",
            "exact-provider-cli-toolchain-setup",
            "provider-cli-toolchain-authority",
            "provider-cli-toolchain-exact-lock",
            "exact-provider-cli-package-content-proposal-schema"
          ],
          "executionOwners": [
            {
              "kind": "test-path",
              "path": "scripts/test-propose-provider-cli-package-content.mjs"
            }
          ]
        },
        {
          "claimId": "fresh-install-and-setup.proves.05",
          "entryId": "fresh-install-and-setup",
          "domain": "install",
          "kind": "proves",
          "text": "Static product-template scaffold bytes are closed by the published scaffold lock.",
          "sourceIds": [
            "exact-product-template-scaffold-lock",
            "product-template-package-contract"
          ],
          "executionOwners": [
            {
              "kind": "test-path",
              "path": "scripts/test-product-template-scaffold-lock.mjs"
            }
          ]
        },
        {
          "claimId": "fresh-install-and-setup.does-not-prove.01",
          "entryId": "fresh-install-and-setup",
          "domain": "install",
          "kind": "does-not-prove",
          "text": "A specific cloud vendor image, secret provisioner or provider CLI is externally certified.",
          "sourceIds": [
            "governance-infrastructure-runbook",
            "provider-cli-toolchain-authority"
          ],
          "executionOwners": [
            {
              "kind": "test-path",
              "path": "scripts/test-setup-governance.mjs"
            }
          ]
        },
        {